{
  "$schema": "./schemas/adjudication.schema.json",
  "format": "cognium-a11y-adjudication",
  "format_version": "1.0.0",
  "generated": "2026-10-19",
  "policy": {
    "expiry": "A reviewed judgement expires when the assertion it is about changes, and not otherwise. Each record pins a digest over its case id, min_criteria and must_not_report. Metadata, notes, user needs, and every other case in the same family move freely without expiring it. Corpus-wide and family-wide keys were both tried and both expired reviews nobody had questioned.",
    "sourcing": "Every decision cites a public source. An assertion is never changed to match current tool behaviour alone; that would make the corpus track the tools instead of the standard.",
    "scope": "An assertion no engine reports is not thereby wrong, and not thereby right. Two engines agreeing on silence is enough to flag a question, never enough to settle it as wrong."
  },
  "decisions": [
    {
      "case_id": "aaa-abbreviations",
      "criterion": "3.1.4",
      "outcome": "correct-unimplemented",
      "source": "https://www.w3.org/WAI/WCAG22/Understanding/",
      "rationale": "The assertion follows the Understanding document for this AAA criterion. Neither engine consulted evaluated a single AAA criterion anywhere on the corpus, so the silence reflects engine scope rather than a defect in the fixture.",
      "reviewer": "maintainer review, a11y-benchmark",
      "family": "aaa",
      "assertion_sha256": "sha256:49eb3113c0f729781f8e34e557b942e3c1818cf1f8bf1c2bd2f6b309f1bf5cde",
      "reviewed_on": "2026-10-14",
      "engines_consulted": [
        "axe-core 4.14.0",
        "HTML_CodeSniffer 2.5.1"
      ],
      "notes": "Re-pinned after a metadata-only change to the family: the method list and state_dependency moved, the fixture and its min_criteria did not. The judgement this decision records is about the assertion, which is unchanged. Re-pinned in a contributor pull request for #56: other aaa pairs changed, this fixture and its min_criteria did not. The judgement is unchanged; the re-pin awaits maintainer confirmation."
    },
    {
      "case_id": "aaa-accessible_auth_enhanced",
      "criterion": "3.3.9",
      "outcome": "correct-unimplemented",
      "source": "https://www.w3.org/WAI/WCAG22/Understanding/",
      "rationale": "The assertion follows the Understanding document for this AAA criterion. Neither engine consulted evaluated a single AAA criterion anywhere on the corpus, so the silence reflects engine scope rather than a defect in the fixture.",
      "reviewer": "maintainer review, a11y-benchmark",
      "family": "aaa",
      "assertion_sha256": "sha256:5fe52f24b5ed153992ebf3c00d682399a0693f912b9be2ac59461852e6c72c97",
      "reviewed_on": "2026-10-14",
      "engines_consulted": [
        "axe-core 4.14.0",
        "HTML_CodeSniffer 2.5.1"
      ],
      "notes": "Re-pinned after a metadata-only change to the family: the method list and state_dependency moved, the fixture and its min_criteria did not. The judgement this decision records is about the assertion, which is unchanged. Re-pinned in a contributor pull request for #56: other aaa pairs changed, this fixture and its min_criteria did not. The judgement is unchanged; the re-pin awaits maintainer confirmation."
    },
    {
      "case_id": "aaa-concurrent_input",
      "criterion": "2.5.6",
      "outcome": "correct-unimplemented",
      "source": "https://www.w3.org/WAI/WCAG22/Understanding/",
      "rationale": "The assertion follows the Understanding document for this AAA criterion. Neither engine consulted evaluated a single AAA criterion anywhere on the corpus, so the silence reflects engine scope rather than a defect in the fixture.",
      "reviewer": "maintainer review, a11y-benchmark",
      "family": "aaa",
      "assertion_sha256": "sha256:03938328c969e025c93b6efdd259a3b88af46859c666421f3848dcc0de419711",
      "reviewed_on": "2026-10-14",
      "engines_consulted": [
        "axe-core 4.14.0",
        "HTML_CodeSniffer 2.5.1"
      ],
      "notes": "Re-pinned after a metadata-only change to the family: the method list and state_dependency moved, the fixture and its min_criteria did not. The judgement this decision records is about the assertion, which is unchanged. Re-pinned in a contributor pull request for #56: other aaa pairs changed, this fixture and its min_criteria did not. The judgement is unchanged; the re-pin awaits maintainer confirmation."
    },
    {
      "case_id": "aaa-error_prevention_all",
      "criterion": "3.3.6",
      "outcome": "correct-unimplemented",
      "source": "https://www.w3.org/WAI/WCAG22/Understanding/",
      "rationale": "The assertion follows the Understanding document for this AAA criterion. Neither engine consulted evaluated a single AAA criterion anywhere on the corpus, so the silence reflects engine scope rather than a defect in the fixture.",
      "reviewer": "maintainer review, a11y-benchmark",
      "family": "aaa",
      "assertion_sha256": "sha256:bb61ef2577b8c342e6898d1ffd5eeac9f9bb0e31fab93a7a1393043faa6d1684",
      "reviewed_on": "2026-10-14",
      "engines_consulted": [
        "axe-core 4.14.0",
        "HTML_CodeSniffer 2.5.1"
      ],
      "notes": "Re-pinned after a metadata-only change to the family: the method list and state_dependency moved, the fixture and its min_criteria did not. The judgement this decision records is about the assertion, which is unchanged. Re-pinned in a contributor pull request for #56: other aaa pairs changed, this fixture and its min_criteria did not. The judgement is unchanged; the re-pin awaits maintainer confirmation."
    },
    {
      "case_id": "aaa-focus_appearance",
      "criterion": "2.4.13",
      "outcome": "correct-unimplemented",
      "source": "https://www.w3.org/WAI/WCAG22/Understanding/",
      "rationale": "The assertion follows the Understanding document for this AAA criterion. Neither engine consulted evaluated a single AAA criterion anywhere on the corpus, so the silence reflects engine scope rather than a defect in the fixture.",
      "reviewer": "maintainer review, a11y-benchmark",
      "family": "aaa",
      "assertion_sha256": "sha256:7d3c362aa1ed38f030ed78db11a7af880e3f79c0c9377559716a835f57050e6e",
      "reviewed_on": "2026-10-14",
      "engines_consulted": [
        "axe-core 4.14.0",
        "HTML_CodeSniffer 2.5.1"
      ],
      "notes": "Re-pinned after a metadata-only change to the family: the method list and state_dependency moved, the fixture and its min_criteria did not. The judgement this decision records is about the assertion, which is unchanged. Re-pinned in a contributor pull request for #56: other aaa pairs changed, this fixture and its min_criteria did not. The judgement is unchanged; the re-pin awaits maintainer confirmation."
    },
    {
      "case_id": "aaa-focus_not_obscured_enhanced",
      "criterion": "2.4.12",
      "outcome": "correct-unimplemented",
      "source": "https://www.w3.org/WAI/WCAG22/Understanding/",
      "rationale": "The assertion follows the Understanding document for this AAA criterion. Neither engine consulted evaluated a single AAA criterion anywhere on the corpus, so the silence reflects engine scope rather than a defect in the fixture.",
      "reviewer": "maintainer review, a11y-benchmark",
      "family": "aaa",
      "assertion_sha256": "sha256:0486904396929230eedae505ecfa179be73f28fa6ea16780a86fc5e7a1c9a4ca",
      "reviewed_on": "2026-10-14",
      "engines_consulted": [
        "axe-core 4.14.0",
        "HTML_CodeSniffer 2.5.1"
      ],
      "notes": "Re-pinned after a metadata-only change to the family: the method list and state_dependency moved, the fixture and its min_criteria did not. The judgement this decision records is about the assertion, which is unchanged. Re-pinned in a contributor pull request for #56: only the corrected control changed, reserving footer space for the Back link as well. The assertion (2.4.12 on the broken page) is unchanged; the re-pin awaits maintainer confirmation."
    },
    {
      "case_id": "aaa-help",
      "criterion": "3.3.5",
      "outcome": "correct-unimplemented",
      "source": "https://www.w3.org/WAI/WCAG22/Understanding/",
      "rationale": "The assertion follows the Understanding document for this AAA criterion. Neither engine consulted evaluated a single AAA criterion anywhere on the corpus, so the silence reflects engine scope rather than a defect in the fixture.",
      "reviewer": "maintainer review, a11y-benchmark",
      "family": "aaa",
      "assertion_sha256": "sha256:a1d112bc171e970b67fd727aa4b0dea750fb2505fae1e0fb7ba047759c5b38dc",
      "reviewed_on": "2026-10-14",
      "engines_consulted": [
        "axe-core 4.14.0",
        "HTML_CodeSniffer 2.5.1"
      ],
      "notes": "Re-pinned after a metadata-only change to the family: the method list and state_dependency moved, the fixture and its min_criteria did not. The judgement this decision records is about the assertion, which is unchanged. Re-pinned in a contributor pull request for #56: other aaa pairs changed, this fixture and its min_criteria did not. The judgement is unchanged; the re-pin awaits maintainer confirmation."
    },
    {
      "case_id": "aaa-identify_purpose",
      "criterion": "1.3.6",
      "outcome": "correct-unimplemented",
      "source": "https://www.w3.org/WAI/WCAG22/Understanding/",
      "rationale": "The assertion follows the Understanding document for this AAA criterion. Neither engine consulted evaluated a single AAA criterion anywhere on the corpus, so the silence reflects engine scope rather than a defect in the fixture.",
      "reviewer": "maintainer review, a11y-benchmark",
      "family": "aaa",
      "assertion_sha256": "sha256:153a2c25130ce9cacf7eec54fa575ce7e6e88497a58b3344dade541dfc42f30c",
      "reviewed_on": "2026-10-14",
      "engines_consulted": [
        "axe-core 4.14.0",
        "HTML_CodeSniffer 2.5.1"
      ],